{
  "v": 1,
  "player": {
    "id": "clplayer0001",
    "name": "Wendell",
    "guest_id": "guest-mgx1a2b3c4"
  },
  "spirits": [
    {
      "id": "sp-ember-fox",
      "name": "Ember Fox",
      "element": "fire",
      "family": "fox",
      "sittings": 3,
      "born": {
        "where": "the Big Mind cave",
        "at": "2026-10-19T18:02:00.000Z"
      },
      "lineage": [
        {
          "where": "the Big Mind cave",
          "at": "2026-10-19T18:02:00.000Z"
        }
      ],
      "loadout": true,
      "care": {
        "last": "2026-10-20T09:00:00.000Z",
        "state": "well"
      }
    }
  ],
  "hand": [
    {
      "id": "a6",
      "kind": "card",
      "title": "Show up",
      "from": "sprout"
    },
    {
      "id": "bar-1",
      "kind": "bar",
      "title": "Ask for help",
      "from": "sprout"
    }
  ],
  "qi": 4.5,
  "vibeulons": 2,
  "embers": [
    {
      "id": "ember-1",
      "source": "wave",
      "element": "water",
      "look": 0.6,
      "state": "part",
      "at": "2026-10-20T10:00:00.000Z",
      "label": "first tide"
    }
  ],
  "places_reached": [
    "vessel",
    "sprout",
    "cave",
    "between"
  ],
  "updated_at": "2026-10-21T02:00:00.000Z"
}
